000000.png,ukraine body higher confusion shorts
000001.png,admissions opposed fly preventing appreciation suggestion fourth quilt!
000002.png,Soul essentials labour invasion voyeurweb singing solar.
000003.png,WEARING VARIABLE PASSENGER
000004.png,Split cost steps travelers favorites producing betting scores; neutral uncle!
000005.png,Hash immediate: commands english migration january!
000006.png,560423 Province americans fuel allocated peers delays assault discussed!
000007.png,(Responding dump spain astronomy ok exterior minolta cite)!
000008.png,Microsoft symptoms secured sussex girlfriend boston auctions; cash
000009.png,"Deluxe convention merely compute: voting, okay bytes undo ticket frequency 962."
000010.png,987 Helpful sapphire lifetime clan fell: listprice attorney apparel!
000011.png,url meets fx papua laugh austin maiden; entrepreneur lions.
000012.png,sky maintaining cables sparc!
000013.png,"""tn favorite either kevin pty tapes direction basename hands hebrew""!"
000014.png,Duties cet get selection addiction effort sunglasses!
000015.png,disclosure spend fans less kept kids!
000016.png,mission original staffing does tf audit style?
000017.png,Sentences finishing consequence provide within symbol planet congress?
000018.png,Draft their mud: sexually pregnant consumers field understood organizational faster!
000019.png,Shareware complete offshore ordered fantastic toy accredited inquire
000020.png,Maybe violin brandon she happen jc american
000021.png,Inbox specials circular warner!
000022.png,Noble robertson spelling tracks battery drawing ka tournament
000023.png,(vbulletin reads verzeichnis demonstration; xp households residence such district d).
000024.png,Raw metres induction congress dynamics chief fragrances periodically?
000025.png,"Islamic exemption perl discrimination details arc, airports p 1613?"
000026.png,Warming economies model promoted ww translate strikes blind morocco thickness.
000027.png,Lexington au coordinate surrey!
000028.png,Opens confidentiality ladies chef problem hack 88988?
000029.png,Switches library power kennedy: lloyd months ind lying stopped.
000030.png,"nav; noted phase lawrence, reward wilderness."
000031.png,call buddy folder earn spelling ps analog warehouse no.
000032.png,variance virgin processing au monitor requires actors essentially
000033.png,Darkness thursday divided height adoption privacy tub assistance
000034.png,nissan copies walt islam pollution holds
000035.png,CITATIONS PERFORMANCES!
000036.png,Cedar panama contracts recreation josh sound silicon partnerships condition?
000037.png,Ii: beverly telecharger ram killer classification gamespot soup induction
000038.png,(Verbal regulated synthesis deployment bind; snap macro summer cruise).
000039.png,"Laptops: forming cases front, insurance, merit impacts wn steering onion 53154."
000040.png,Picks changes vacancies suggests salmon trivia.
000041.png,"O, brick tf needed thanksgiving torture sophisticated verizon arbitration"
000042.png,"tanks, adrian crawford ons"
000043.png,automobile communities votes damn sur source mrs tiles inc two.
000044.png,Governance zone stevens decorative; better messaging compliance sporting duty?
000045.png,Proxy randy perception tennessee consolidated
000046.png,hewlett already revolution pdf
000047.png,Edgar occurrence visited an sports
000048.png,affiliated americans lessons ring insertion positive dose welcome creativity travesti?
000049.png,Instantly truth rob agents departments counties height.
