014574.png,af action feelings
014575.png,"roles confidential arg, real"
014576.png,apps cooling gaps?
014577.png,Sandra sport inch
014578.png,Festivals ice montreal tions beer
014579.png,importance nipple bias quiet barn exterior method?
014580.png,transparency least
014581.png,Torture gangbang auburn reveal
014582.png,ward tune wesley brothers searching highs yes
014583.png,petroleum hints diy suggest ports
014584.png,Code rwanda?
014585.png,ict variety necessarily
014586.png,Preferences trade signatures fg clarke slightly genesis?
014587.png,midi colored arrangement!
014588.png,Evolution green war sexually jeff
014589.png,Ut alternate gratis social
014590.png,service custom dominican efficiently versions ct
014591.png,cn rabbit ampland launch
014592.png,variations hole framed opposite cube
014593.png,Netscape goto tube respondent lesbian what ought.
014594.png,bowl ya barbie removable does
014595.png,cp help walt nt customer
014596.png,Commit kai delete unlike candidates
014597.png,emission rest scores incorporate
014598.png,road viewing form yugoslavia bracelets classic injured
014599.png,providing boom families
014600.png,settled cholesterol.
014601.png,Grounds supplemental charter tire yukon continuity cayman
014602.png,Jury carlo ham excited wax ronald
014603.png,Valve bizarre para?
014604.png,"answered latvia receives, candles weapon"
014605.png,bills gift earning thorough burden.
014606.png,puzzles binary tribe myanmar
014607.png,Mechanical homework
014608.png,"Processes webshots, breeding remark pirates commander"
014609.png,Piece connectivity smoke afraid albania distinction bermuda
014610.png,capabilities finishing unto conclusions kruger mud
014611.png,knights abortion
014612.png,patio fixed tennis
014613.png,knight monster distinction
014614.png,metallic tank bleeding printers grown impressive chef
014615.png,Carlos logan beatles hints two irish!
014616.png,bali exhibition ss
014617.png,Allow tin ppc beta style beverly apple
014618.png,Se aug agreed quoted neck
014619.png,constitution finest gtk helps baby fragrance res
014620.png,reviewing heart miami depending.
014621.png,Provide benjamin slope ended relevant
014622.png,Senegal troops te queens implies preferences manchester
014623.png,Ends chamber radius surveillance written regularly brokers
014624.png,Powerpoint alice apparatus homework whom kirk mask
014625.png,"fat seem, gc potential chance"
014626.png,"hourly largest ordered, appreciate."
014627.png,likes confused antigua projectors universal dramatic
014628.png,regularly arguments semi connection
014629.png,issued kentucky chocolate raise disorder!
014630.png,Spreading conscious sbjct okay escort ray temperature
014631.png,armstrong featured urw gangbang
014632.png,against seasonal payable knit
014633.png,Routers blowing expiration expensive
014634.png,maine cameron
014635.png,pleasure madison gzip?
014636.png,Rides childrens
014637.png,"Steal clinton need fioricet reasonable, reliability!"
014638.png,intention awards mozilla chart neighborhood retirement
014639.png,Representing fitting belfast clinics hottest
014640.png,biodiversity sales ha annual ya sur
014641.png,arrived directors exam false saw dis courier
014642.png,Others graduates add principles seasonal
014643.png,soviet dp officially transexual census philadelphia
014644.png,Angry humans bird terms.
014645.png,Skip brokers mpegs punch
014646.png,eval medical usgs
014647.png,bigger calculate fighting
014648.png,frame mesh jamaica ind franklin ceiling during?
014649.png,mood medicine neither identical sc
014650.png,verified educated little pearl une earn!
014651.png,Themselves than assessed upgrade babes
014652.png,Census billy bag mon
014653.png,"Vertex comparative estimates reviewed, journalist"
014654.png,explicitly adoption dakota customize
014655.png,Consider main pets bored investigated ice penis
014656.png,Manage desert chip lucy boxes upgrades angel
014657.png,involving decorating trustee sit rolls clarke!
014658.png,Iowa motorcycles holiday norman vancouver
014659.png,Businesses write?
014660.png,limousines ensuring reaction doom neural
014661.png,"atlas casual sense continent roles, guaranteed"
014662.png,"honey benjamin visitors kim side suggestion, worldwide"
014663.png,discrete ensure or workshop inquire arena command
014664.png,cameroon constitutes buffalo passion temperatures
014665.png,valuation telephony california skin quality prizes
014666.png,spain emacs harassment oclc.
014667.png,harper lock pig calculation candy police sorted.
014668.png,wheel off venue conviction roles exhibits wan
014669.png,Transactions handmade members
014670.png,historical hwy quad memorabilia.
014671.png,asking been nil blame satellite
014672.png,flexibility dining.
014673.png,Knitting eye lingerie retrieval deer
014674.png,generator exercises lesson rel nutritional
014675.png,varied whatever holland taken come easter
014676.png,Spell fotos kill courier core reunion ind
014677.png,Environments doors broker farmers keno
014678.png,Ic alabama
014679.png,Editing yes brighton delegation mileage center
014680.png,crucial six mounts collectible
014681.png,Pre politicians seafood gold
014682.png,Furniture netscape coordinator.
014683.png,dies conducted legends present fs cheers san
014684.png,Felt commissions important
014685.png,Only funny
014686.png,nude returned claim live alpha stuffed smile.
014687.png,Studies latinas
014688.png,sd cannon superior
014689.png,harvard warcraft predicted psychology jacob charlotte
014690.png,placed bibliography labeled seekers relax
014691.png,considers dairy though special positioning pound?
014692.png,fabrics ppm soldiers
014693.png,karen buildings manner focusing grow villages
014694.png,"planets disks bbc, holy?"
014695.png,pets sri elected politicians nbc
014696.png,chile maintaining extending females accounts
014697.png,registrar lived chan analyses referral because
014698.png,disputes forms rush island mode
014699.png,Bidding changes political suffering bookings periods inputs
014700.png,pensions zip
014701.png,connection district islamic cabinets pond distinct falling
014702.png,Suppose wind pass!
014703.png,geek lift dozen packet
014704.png,Customize derby bizrate
014705.png,Affiliate sometimes too worldsex amounts privilege cow
014706.png,Tide she ebooks sn?
014707.png,ground mouth livestock
014708.png,Delicious skins les lakes brothers state
014709.png,eddie um nb les decent act
014710.png,katie moreover
014711.png,beverly stomach mesh fisheries sellers performance
014712.png,peak tyler accepted dos findlaw
014713.png,tvcom ata
014714.png,Joint predictions smoking diameter gets therapeutic
014715.png,acne visibility
014716.png,translated exhibits
014717.png,contact enhancement
014718.png,ex reading edge ability nba struck
014719.png,Exact budget glucose stayed supervisor jar?
014720.png,promptly collectables strategic suggestions restored.
014721.png,Bookings training conclude combining hollow
014722.png,"foo toward, chairman syndication always dear study"
014723.png,"basically allergy litigation, grain"
014724.png,Picture came jersey consistently volumes janet
014725.png,Lyrics annotation scoop years azerbaijan travels developed
014726.png,Pairs partnership herein thanksgiving
014727.png,Watched cursor bills
014728.png,cry legislature
014729.png,creator indicates concepts whereas libs
014730.png,boolean intake regime auckland greeting mate officers
014731.png,Immigrants emerald
014732.png,css docs settle barrier thesis slot.
014733.png,graduated parliament
014734.png,Wishes debug hotels catering
014735.png,"trademark dave tested, ce"
014736.png,paintball browsing null gdp single
014737.png,images thomas
014738.png,lions ipod alfred serious believe outlook chris
014739.png,Cancer cancelled laughing protest history knew hollywood
014740.png,samba marathon round burke palmer mn fonts?
014741.png,evaluation bin puzzles
014742.png,Seemed greeting fairy
014743.png,equity berlin indians closing proceeding ak interest
014744.png,gardening ceremony suits intensive shower
014745.png,Porsche letter thanks room franklin
014746.png,Statement whore then survive blade stewart hu?
014747.png,arrangements dealtime badge rt photographs justify
014748.png,Adaptor conjunction framing
014749.png,subscriber topless
014750.png,files disk satellite component saver substances
014751.png,Injection luke!
014752.png,"gravity word citizens privilege, few discs"
014753.png,cordless aggregate
014754.png,Tiffany owners copying quantities
014755.png,reproduce ads forty amp confidential golden
014756.png,campus social mens karl breed unable
014757.png,workflow struct tables porsche sends hello advertisers
014758.png,experiment uv complexity telephony subcommittee
014759.png,contains my disciplinary gym
014760.png,Nigeria semester furthermore
014761.png,champagne backgrounds caring sick customers deputy kinds
014762.png,hiking advisors initiative cars whale
014763.png,lamp thick!
014764.png,sara ruby ur candidates bk
014765.png,until licensing
014766.png,firm kingston enhancing?
014767.png,"approval pottery, atm centres"
014768.png,Entering alto award jefferson medicaid.
014769.png,however haiti enjoyed.
014770.png,betting vii.
014771.png,Dependent laws bike sure mon
014772.png,alloy removed wonderful
014773.png,Findlaw counters
014774.png,letting finest preservation
014775.png,Decide projectors?
014776.png,chips dropped contributed cocks asn scripting
014777.png,Succeed plants
014778.png,cycle fallen imports jpeg frequent judges murray
014779.png,bat bangkok express possibility abstract
014780.png,Tramadol pb
014781.png,factor electro div?
014782.png,vi grow sf mortgage realtors powered paying
014783.png,applying exempt officers theater
014784.png,aluminum expenses relevance bay owen volume oclc
014785.png,were icons forced sensor volt gras
014786.png,Maintain glen prevent oven modules black typical
014787.png,excellent troops banking wed
014788.png,brunei author constructed poem macedonia!
014789.png,coleman crop nil horrible soul slot perception!
014790.png,Shower gif law
014791.png,wilson libraries violation play derek volt
014792.png,ext cliff direct
014793.png,Cube malaysia limits displaying flights sandwich leon
014794.png,"Identify onion calculation chen ballot, rainbow ia"
014795.png,Levitra modes hazard fundamentals keith
014796.png,durham hospital fighters?
014797.png,prerequisite mu fu contributors prix fingering keeping
014798.png,hospital foods journalism
014799.png,tie dpi ways candle?
014800.png,Cheats config surprised
014801.png,tier safe dept chat gratuit colonial
014802.png,judy ended races wto
014803.png,literature committee sm limited programmer rm
014804.png,documentary parameter robinson cartoons.
014805.png,Saw valves timothy headphones stick locate kept
014806.png,mb insider anthropology ringtones cnet authors nonprofit
014807.png,trainers stats cumulative consultant
014808.png,"Recycling jennifer, gets shirts ontario celebrate latinas"
014809.png,framework posing logitech
014810.png,"Heights vic trends citysearch, weights?"
014811.png,last fujitsu transmitted plains mature?
014812.png,Filtering plugins seconds each phil snow
014813.png,bikes exhibition smilies mouth victims option hollywood?
014814.png,imported shop ancient leave!
014815.png,"Elevation yoga, millions neutral speech!"
014816.png,down stable ascii with starts
014817.png,dale strikes directly ii utc
014818.png,herein aud surplus obituaries
014819.png,Municipal diffs eq cho six
014820.png,girls tape boolean structure
014821.png,Agrees fur act ll ne elimination!
014822.png,"determined smart nasa, strange bracket proposed"
014823.png,fixtures proceeding cedar!
014824.png,kit nurse
014825.png,"Beth vb govt, jacket invoice"
014826.png,illegal nursing words
014827.png,"signup pp rebound virtually, illustrated"
014828.png,upon kennedy singh.
014829.png,ball stages spent lil reaching celebration!
014830.png,Magic overhead
014831.png,Fibre slovakia claim selection intend counties amend
014832.png,Students voluntary pins surprised combine
014833.png,icons unity specify dresses polyester trades jesus
014834.png,crm by reggae
014835.png,ensuring aimed destiny
014836.png,young installing
014837.png,Travel dependence brazil considers cest
014838.png,About persian
014839.png,Bunch silent responsible bodies tucson highlights
014840.png,districts abraham refined gs pre bars schema
014841.png,portugal formation test
014842.png,courtesy accepted
014843.png,gd rome courtesy
014844.png,pichunter wan disabled ons institutions assistance mold
014845.png,Mw red knitting voyeurweb paris focused
014846.png,loading para gamecube dicke
014847.png,Draft true puts devices br marine puts
014848.png,account mb?
014849.png,india identical conspiracy
014850.png,blind facing animals respond supply implies thin
014851.png,motivated procedure shaped presidential determined am forum
014852.png,lightning dx libs links serial madagascar rand?
014853.png,Textiles ipaq bb exclusion
014854.png,rome ok
014855.png,hung assure entrepreneur gerald
014856.png,pa campaigns guidance center
014857.png,lance operating occupation helpful getting
014858.png,pro incurred joyce.
014859.png,carries zen longest dosage sapphire removing nonprofit
014860.png,Brother ears.
014861.png,portal forwarding magic md guest baths
014862.png,Saturn housewares craig combat highway nation ie
014863.png,justice swiss adopt cleaner shemales pierce
014864.png,Catalog pending exec faqs bbw
014865.png,venezuela deposit judgment audit
014866.png,enlargement cork nec testing sigma euros rebound!
014867.png,Industry employed neighbors
014868.png,fully tramadol vocal statutory may allah lexmark
014869.png,scanned nz iron.
014870.png,allow employers specifies promise computed hash?
014871.png,Resolved dental forestry aged shake aspnet convenience
014872.png,"failed approach br nightlife, trace"
014873.png,Slip opera most
014874.png,cylinder psp asian schools?
014875.png,select websites desert le referrals
014876.png,lens dave ever.
014877.png,Size adrian
014878.png,obligation cnn trees wet jews connector
014879.png,answering diet
014880.png,wider fly hits
014881.png,soil rebate baskets uh florist
014882.png,snowboard ghz nuts myspace potentially fm?
014883.png,Wires abortion opens dialog sharp
014884.png,historical fastest salaries
014885.png,Everybody impacts constitution personalized counts
014886.png,Forbidden discusses
014887.png,Fatty illinois favorites
014888.png,freeware investors nitrogen integrated reef libs sense
014889.png,accepted most collecting nationwide her
014890.png,Pretty calculated nv
014891.png,oh christmas axis
014892.png,shortly identifying nonprofit informed emotional!
014893.png,logical refrigerator kinase indicate map
014894.png,Rebel simplified john continuing hwy conjunction
014895.png,expanded sen bd bmw adequate hot
014896.png,shepherd generous convinced
014897.png,Nutrition activated eval shaved familiar mate organisms
014898.png,Discussing given innovative covering?
014899.png,joshua rule lan hostels projectors young
014900.png,Use balanced wishes fed female!
014901.png,Organisation secondary label
014902.png,Assume sunday rip kind loan spin
014903.png,Shaped rentcom bolivia demanding dale
014904.png,france ebony latitude accessing brush consolidated xnxx
014905.png,colors electron operating anderson.
014906.png,Broken ii imagination framing navigation individual swim?
014907.png,follow enabled empire feat utah quest five
014908.png,buck volleyball carnival?
014909.png,"news scheduled alex deborah, groups testing disc"
014910.png,shoes adelaide governments walking
014911.png,payday statutes snow!
014912.png,headline diverse sat
014913.png,Appreciated ultram targets wool
014914.png,Rated effect logged print
014915.png,bingo changes lines buttons warm
014916.png,controllers buying threats class.
014917.png,"headed alberta banks, prepaid george"
014918.png,disposition gerald
014919.png,Juice strap postal.
014920.png,elementary gale timeline
014921.png,Committees applied mint.
014922.png,oklahoma separately necklace unauthorized expressed collapse
014923.png,merchant searches interactive
014924.png,journalist building jazz flush lid calendars
014925.png,Holly ap kinase losing prairie rural
014926.png,"Arena origin, spectacular auto"
014927.png,paso samoa munich enrollment!
014928.png,Fruit rosa prohibited shoppers ejaculation!
014929.png,Audi enb
014930.png,Appendix blind turkish lying attempted interested chargers
014931.png,negotiation governmental src enquiries
014932.png,conclude twin
014933.png,bukkake cl bars hazard eu
014934.png,"strength mid, pollution whole republic asin"
014935.png,"Train beautifully knowing, arcade"
014936.png,"Cultures wedding german trick companies, johns"
014937.png,mauritius admit chart elephant
014938.png,Britannica near caution hundred?
014939.png,Exercise crown
014940.png,Optimal attorney throws
014941.png,Chan name
014942.png,Spotlight hayes
014943.png,"genuine michel rv benjamin, sans"
014944.png,notre machines workshops penny courses
014945.png,reg impacts distances oak clarity center
014946.png,present familiar paste favorite sand
014947.png,Heads worship movements weight
014948.png,Judges limits indoor achieving affiliate lines
014949.png,"Magic euros, lighter areas"
014950.png,"Paragraphs tmp dance namely chassis, denmark"
014951.png,basket abu performing
014952.png,rep tomatoes villas?
014953.png,Nursing usage arbitrary.
014954.png,Wu spare bang inquiries plain
014955.png,emission karaoke spoke famous levy
014956.png,tahoe length dog never
014957.png,vietnam weblog fx slots
014958.png,Toxic chances contractor
014959.png,entitled settings lo rx
014960.png,integration flush dna
014961.png,brochures figured?
014962.png,preserve alcohol
014963.png,holders incomplete included
014964.png,llp reserves overseas propose
014965.png,Eat aspects wav?
014966.png,bulletin egg clearly recipe pathology
014967.png,"adidas deep reduce calm, complexity execution axis!"
014968.png,thailand looksmart
014969.png,pins transsexual websites bedrooms ideal lord range
014970.png,"Why listings testimonials, huge introduction"
014971.png,horizon occurs arrangement ge aspects
014972.png,cached network penn commodity oxygen
014973.png,fast france
014974.png,Sao succeed tray cant
014975.png,Arrest happening comply perfect merely technologies
014976.png,locate common?
014977.png,failure extra relief
014978.png,interstate refer
014979.png,untitled sc saves primary technology
014980.png,css nz ln
014981.png,"panasonic pts scientists jurisdiction renaissance credit, gnu?"
014982.png,perfume anymore budgets harbor layout incomplete segment
014983.png,Patents lycos
014984.png,Flying subaru european lowest
014985.png,jose primarily
014986.png,reserve hitachi isaac offerings.
014987.png,Boulevard iso bangbus signature beginning?
014988.png,inform month booth soil macedonia initially mall.
014989.png,Indian without britannica de mitsubishi
014990.png,"dublin composer coordinates jill, entering staying"
014991.png,Baseball scholarships messages polished nodes
014992.png,meter lawrence wishlist io pussy acre
014993.png,controlled those halo durable themes board doll
014994.png,shortcuts rebel burden developer productive relate nebraska
014995.png,analytical impose worth
014996.png,"Buildings jenny guaranteed fatty, individually mouse"
014997.png,diameter patent anywhere
014998.png,cylinder rip lakes
014999.png,Pair hollywood cl families inexpensive?
015000.png,cat have attitude gain minute mailed
015001.png,statutory bdsm kate flights remarks
015002.png,shuttle chancellor posted
015003.png,bee passive fort cat measurements
015004.png,advertisers std alt invention media
015005.png,statewide weblogs gm!
015006.png,"pet elections space recognition, images turned adjust!"
015007.png,Inter harley prozac deer showing
015008.png,previous surgical meeting
015009.png,relates discussed counseling departments parallel decorating recent
015010.png,endif package asset counties
015011.png,blank kodak ranked peter loading military gen
015012.png,exist wire lcd blend feeds postcards western
015013.png,scenario handbook coaches granny phase jordan silly
015014.png,Glucose pod beverages motels?
015015.png,Brad surfing significance talk
015016.png,national cook logical
015017.png,Harassment quarterly revenues
015018.png,Removable airline moreover segments diamonds
015019.png,belfast uni headquarters!
015020.png,folks metro small
015021.png,Scripts matthew dim added ultra dispute
015022.png,"Sociology kazakhstan, restored celebrate considerable vision"
015023.png,Confusion of
015024.png,Have bangladesh rose
015025.png,Journalist karen brooks testament limits
015026.png,capable teens waves produces bedroom joshua hitachi
015027.png,editorial cloud
015028.png,Buyers generations dist
015029.png,makers prefix submitted
015030.png,Leasing aviation journals scsi pocket handle
015031.png,"ti dedicated, accept citizenship fd mapping"
015032.png,pricing penalties mouse?
015033.png,Practice models affect
015034.png,yang rounds pen
015035.png,mounting organic passenger soma
015036.png,meals vacancies covering
015037.png,diversity hop
015038.png,Jelsoft signup msgid rev drums
015039.png,justice remaining pennsylvania digest cups.
015040.png,motors wind iii streams adverse
015041.png,math actually mark
015042.png,carries conspiracy
015043.png,Darwin scotia practices com.
015044.png,Manufacturer provide themes reach indians novelty quality
015045.png,toolbar companies
015046.png,ye expanded developed arrive zu security
015047.png,wa proposed delicious ringtones thru writing annie
015048.png,interactive reflect carriers solve bad late
015049.png,Beliefs latino
015050.png,eagle annotation table losing molecules handjobs jesus
015051.png,Cancellation dan editors sen
015052.png,after attempting retirement surprised momentum repeat
015053.png,plan followed!
015054.png,lesbians mardi
015055.png,ng reggae
015056.png,discussion wealth makes?
015057.png,membership football jimmy chess?
015058.png,"Expansys greece estimate, age alignment"
015059.png,removed cyprus dangerous commerce excluding clinic!
015060.png,optimize kenny frontpage mg
015061.png,Departure secrets aquatic
015062.png,print mention courage
015063.png,Looking tits criticism tri another presence compilation.
015064.png,Partnership amy leaders jenny wifi launch
015065.png,Provisions puerto reproduce functioning
015066.png,"thesaurus filter, plastics cyber evaluating ver compare"
015067.png,seniors mississippi scheduling.
015068.png,cabin perspective blades ultimate receive
015069.png,hydraulic wash
015070.png,Chat downtown dispute
015071.png,Guestbook plaintiff preliminary limitations obtained bell business
015072.png,calibration colin videos ids
015073.png,Payments martial jewel fur mambo enemy laboratories
015074.png,Surfaces official
015075.png,visual dash worldcat working singer
015076.png,surgeons stanford
015077.png,sealed english performing expectations prague kilometers.
015078.png,Nasa prix cumulative failure dam
015079.png,Cope pot
015080.png,plans profit botswana tournament
015081.png,"Ppc industrial packard, eggs"
015082.png,independence rio speaking
015083.png,rated vip warrior spring diego
015084.png,Contribute facilities dispatch joining trivia
015085.png,sealed lesser publisher cancelled
015086.png,adventure campus aerial acknowledge liable resort!
015087.png,new consequence karen cigarette matter vampire hotels
015088.png,mega showcase vitamin springs projectors streaming!
015089.png,Focuses island attempting
015090.png,Sf allocation main september continued numbers jane?
015091.png,beat gt demonstrated ten nirvana wc clone
015092.png,check efficient drivers speak irrigation
015093.png,Text yes ascii das?
015094.png,"dr metabolism earth nylon, widely crap"
015095.png,Either second yield habits
015096.png,Provide gaps firmware med usually xml
015097.png,Mp democrat swimming brochures bye webshots
015098.png,Reduce lynn honey extremely metropolitan
015099.png,discovered par feelings controlling
015100.png,injured maine romance deposit jo force
015101.png,bargain boxes den harvest voters
015102.png,Faculty dynamics
015103.png,sell yoga gold mad!
015104.png,bookmark remove designated?
015105.png,avg patricia
015106.png,fr facts donation amy bedding
015107.png,Swingers freeze porsche loans reports move
015108.png,maryland computers configuring atm venture
015109.png,handjob comp!
015110.png,whereas posting bernard plastics
015111.png,repairs pads trends basketball adapter rainbow
015112.png,routes jeans unusual contract blood jan
015113.png,heavy virus layer alumni!
015114.png,"plastics straight lamb homework, ted"
015115.png,spyware neo
015116.png,nasty individually started rabbit surprising agencies
015117.png,classics induced rp
015118.png,herself corrected safety recruiting tamil
015119.png,breasts outdoor ty setup limitations
015120.png,Oak bool skiing profit hack polyphonic
015121.png,Spatial taiwan issues sperm sunrise partition
015122.png,recommends ee access legend ecuador relatively
015123.png,christ cognitive universities scores clear
015124.png,scout slow courage wolf bidder
015125.png,Results hepatitis wait
015126.png,later ri summit easter sensors bang retreat
015127.png,bl gotten everywhere cartridge claimed entities checking
015128.png,terror francisco inns.
015129.png,regions holocaust purposes.
015130.png,glossary educational multiple houston kelkoo homes
