000000.png,Missed settled attacked
000001.png,frost teachers sacred?
000002.png,ne gray cms lauren wings roulette
000003.png,nu receives girls struggle video upc?
000004.png,Finite mali operational obj insurance.
000005.png,Aware supporting injury respondents dynamics dollars senators
000006.png,lady bringing european films
000007.png,increase lecture horror
000008.png,Philadelphia horn regime cab.
000009.png,sixth voters mitchell coastal support week
000010.png,untitled gpl?
000011.png,female courts pointer
000012.png,broadway climbing dennis!
000013.png,Acute winston
000014.png,develops schedule
000015.png,cache copyrights martin rapidly
000016.png,told transition dressing paths apt babes
000017.png,investigate beds business notebook life geek chief
000018.png,yard log bernard dig blowjob regarded beauty
000019.png,Growth toshiba ii open kent
000020.png,savings pounds knee payable.
000021.png,properly induced planners consultation
000022.png,Auto workplace detailed ware elections agencies randy
000023.png,"switching marketplace charts sox, just?"
000024.png,Bid pages drinking entrepreneur lot definitely faster
000025.png,donate number deaths mf codes sculpture
000026.png,una determined domains bacon recreational
000027.png,Foto reserved democrats races racing!
000028.png,proprietary signing waiver observation filed?
000029.png,Skiing interstate motivated
000030.png,title masturbation
000031.png,Strengthen storage arranged
000032.png,Madagascar higher executed downloads reproduced little across
000033.png,waters silly true trial services card locked
000034.png,"clinton champions, preferences microwave token complement"
000035.png,"earnings healing upper tu lion, nn"
000036.png,And hitting eagle pharmacy reseller affair.
000037.png,"sexuality jun centers, champion year"
000038.png,"sail karma, que kirk"
000039.png,Screensavers operations subsidiaries
000040.png,database draws
000041.png,donations jon episode kingston lanka.
000042.png,Excerpt domestic architecture aluminum
000043.png,florist sexuality
000044.png,overnight maui arrow.
000045.png,handbags bonds gaming
000046.png,tracking cayman!
000047.png,"Centuries emotional, predictions pants vhs make"
000048.png,Arrested istanbul angels prospect abc.
000049.png,sizes deserve shield demand michigan.
000050.png,offer helps
000051.png,invasion shore
000052.png,"Physicians banking, mainly merge"
000053.png,"Zealand bare guarantees investigated minimum aqua, benefits"
000054.png,Provisions exclusive magic individual laughing higher
000055.png,ooo recommended fda cdt diffs fl dumb.
000056.png,Moral medium graduation
000057.png,bald denied germany ed phrase work
000058.png,Kong plants spanish compressed
000059.png,movements andrews lovers blowing famous ultram!
000060.png,tribal tops?
000061.png,ntsc angle attempting outcomes
000062.png,Beat earning reading disposal councils
000063.png,vacation bahamas necklace con operated
000064.png,vertical humor prozac filters balanced historic
000065.png,nomination clean dogs sixth enjoy
000066.png,deaths incident programme truly
000067.png,religious equation adopted feeling namely scientist.
000068.png,projected comparisons rochester lead moisture fresh em
000069.png,puzzle genetic onto
000070.png,identify figure serves kids?
000071.png,Least biggest completely
000072.png,Assigned bend continuity dark.
000073.png,ambassador dialog consist flashers inputs sydney phentermine
000074.png,backgrounds sender telephony
000075.png,Funny enrolled?
000076.png,tex catholic darwin eu leu thy
000077.png,affiliated commitment extreme evans
000078.png,hs obligation dual romania radical
000079.png,mirror jm monitored
000080.png,Cancel shaped reliable lp
000081.png,earnings cherry ace!
000082.png,specialist art ranking bl
000083.png,Governor tp sacrifice colin newcastle
000084.png,Gospel reply
000085.png,Change certificates weak nv cz short
000086.png,"swedish corruption tight xl, tolerance event yemen"
000087.png,access flight ship versus breach
000088.png,wed username corrected christina watt cinema?
000089.png,aged sample damaged
000090.png,fits attractions jc lounge tenant radio copies?
000091.png,supplemental families
000092.png,Headset fucked mature cope auburn?
000093.png,author nature
000094.png,eric ny
000095.png,tools surge rural vegetable?
000096.png,prime worm meters guards residential cultural advice
000097.png,launches cartoons!
000098.png,scenes east
000099.png,wrestling script david
000100.png,newfoundland joe holds
000101.png,reduces bizrate furniture diversity bind casino bedford
000102.png,Sexcam header because plymouth thy
000103.png,slow bug
000104.png,lowest macintosh dui commissions johnson
000105.png,Hundreds studying detective vermont
000106.png,alcohol syndication
000107.png,Angel sri lodge occupied favorite mobiles however
000108.png,city spell current unlimited pocket weak
000109.png,bars source!
000110.png,Unity instant gt gbp
000111.png,"yo serve, diane advanced."
000112.png,double loved
000113.png,daughters read
000114.png,interact qatar lewis productions submissions post mentor
000115.png,"findings peterson twisted, advertisers"
000116.png,Squirting united gorgeous
000117.png,Friday published
000118.png,ur acknowledged psp
000119.png,booth accident grants
000120.png,customer iv finland earth alloy
000121.png,recommended corners tp
000122.png,elizabeth cashiers slow lift
000123.png,Distributors egyptian separately fastest
000124.png,Handy period santa deeply various worked kai
000125.png,Prison epic enclosed arrow colombia.
000126.png,cite processed bacteria sanyo
000127.png,arrival transfers grip.
000128.png,destruction eleven dirty webcams chains
000129.png,drink registry crystal.
000130.png,lambda ideas verification friendship sam foo contacted
000131.png,sufficiently answered february accessing premier
000132.png,"hundred grammar territory battle realize, proudly trade"
000133.png,Nurse promise chairman?
000134.png,onion hourly zoning instant
000135.png,"studying allow paste, piss gov degree"
000136.png,diagram le pride!
000137.png,deficit lowest placement
000138.png,Wait ra developments totals
000139.png,assumed acknowledged necessarily intimate what!
000140.png,Wrapped begins uk they
000141.png,bm styles prefers trusted nutrition zoo?
000142.png,Awesome them fiscal regards fired buf fact
000143.png,"brazilian pamela breakdown commercial, parallel initial tonight"
000144.png,Keep nathan thumbzilla foundations lives.
000145.png,Abilities utilize mac?
000146.png,Raises significant hello
000147.png,drove inch brazil exports
000148.png,Membership benjamin probability called
000149.png,historical social?
000150.png,solaris iv.
000151.png,Marketplace pathology postal ide dust
000152.png,Airline programmes yield emerging estimates checklist
000153.png,Kw confused barely ecuador also staffing
000154.png,batman death
000155.png,guild respect alter showed jerusalem
000156.png,Listings scholarships part
000157.png,Wb nfl.
000158.png,Fly proper remix facility trivia tba
000159.png,"spas hotmail inspections, techno?"
000160.png,reached bibliography demand volunteers mixed competitors!
000161.png,virtually appearance borders shopping embassy into
000162.png,Crop relevant
000163.png,Solved satisfied hardcover eyed earliest weed barn
000164.png,Token canvas revision
000165.png,wikipedia operation heater separate
000166.png,indexed terrace probability.
000167.png,"dryer pokemon amount effects xanax, myself nm!"
000168.png,Shelter cancellation heroes remain tracks significant
000169.png,failure pontiac metabolism garden pottery balloon sub
000170.png,Famous oregon
000171.png,Fruit thoroughly table reprint renaissance wound
000172.png,stephen rio bolivia flashers quarters.
000173.png,elevation incentive
000174.png,calculations marion takes odd arrange briefs!
000175.png,compile extraction anymore alone details reached
000176.png,farming characters doll verzeichnis const newcastle
000177.png,artwork int
000178.png,"Constraint bunch herald, history"
000179.png,recreation bidding wallpapers
000180.png,"Sport registered, records aj george lo"
000181.png,tim tractor nuts
000182.png,appointed conceptual challenged female upc wrong router
000183.png,Ba tomatoes iraqi for viruses
000184.png,scanners losing!
000185.png,"best teddy implied, began italia!"
000186.png,streams madness
000187.png,cannon play
000188.png,Specialists accident pi traveller
000189.png,pal muslim publisher fast
000190.png,towers rugs harm condition
000191.png,geological insulin selective assisted corrected projectors
000192.png,"rick leisure very, evaluation colony steady pie"
000193.png,universal finder
000194.png,en watching toshiba hopefully enhancing referred disclaimers
000195.png,Respondent devon addressed examines ceiling
000196.png,transit gnome linking mysql southwest
000197.png,Intelligence restrict gis stereo concluded athletes
000198.png,babe payable gcc letter championship cartoon trap?
000199.png,Est vice asset listening examination
000200.png,Depends colony dependent entrepreneur albania
000201.png,managed festival enables dig lawsuit vital
000202.png,Garlic filter toe summaries
000203.png,Integration sugar city utah kim catalyst
000204.png,Watching mode trek directly fitting farm frequencies
000205.png,starts lid amongst jj
000206.png,Dean lady handles archive
000207.png,Tires mill borough engagement sandra degree!
000208.png,Advocacy font bathrooms attorney combat modify monthly
000209.png,railroad opens
000210.png,Effect effective lecture schemes touring interim
000211.png,utility skilled recipient quiz pitch viewed
000212.png,batman disappointed book dental
000213.png,off retirement capability stats?
000214.png,Read opening cr
000215.png,offset mixing markets deputy las inf?
000216.png,tournament viewed intermediate handles hardcover albuquerque dvds
000217.png,Maternity heavily
000218.png,relative salon resistant
000219.png,common cas bestsellers antarctica
000220.png,hidden gm?
000221.png,identifying columbus minnesota
000222.png,Distribution quick leonard
000223.png,antigua independent wisconsin replaced collapse methods shipped
000224.png,Returning housewares
000225.png,ap missions trends lisa.
000226.png,steel bind trained proposals share.
000227.png,closing section pillow hugh
000228.png,Efforts declined
000229.png,recreational deutsch promoted choices testament
000230.png,columnists neither
000231.png,forecast neighbor managing showcase narrative definition glossary
000232.png,Specialty paxil adopt?
000233.png,select quite nor colour petroleum conferencing viewers?
000234.png,Gibraltar gmc attempting fd
000235.png,Korean organic map demanding wearing!
000236.png,"laptop folk permanent, identity political"
000237.png,lift specialized startup
000238.png,arising membrane follow these boots!
000239.png,Runtime requesting
000240.png,affiliate make re home origins volt?
000241.png,edge bhutan
000242.png,district response dave geographic cities
000243.png,capability ordered instantly flip steam thumbnail
000244.png,Elements dump taylor dat buf vatican
000245.png,Football demonstrated eos subsection gnu martial
000246.png,lcd survival shop piece
000247.png,brian frame
000248.png,competitors insert
000249.png,"deadly quotes, meeting harbor moves prize chinese"
000250.png,"divx assured, zus animals currently rainbow lookup"
000251.png,"facilities shaped daniel naturals, shooting mineral vocational"
000252.png,Messaging cm adapters kim
000253.png,Blade bangbus searches date explosion
000254.png,gd arkansas argument rid syndrome
000255.png,hints protest they?
000256.png,olive beneficial injuries directors sc und
000257.png,impressed clarity
000258.png,topics pj figured ignored lighting xhtml conferences
000259.png,bedrooms wealth.
000260.png,Probably hell trio near
000261.png,cop rim annie?
000262.png,henderson arrange
000263.png,Advised requirement obj fossil struct expense lung!
000264.png,ice boundary gallery clarity petroleum suit became?
000265.png,walter destiny cod roles
000266.png,till congo scholars flower favorites
000267.png,"hosting apr surprised, attend occupational hk"
000268.png,Fear europe antonio turkish bloody
000269.png,"Senator submit, lane mighty expects blades bleeding!"
000270.png,Cest triangle requesting treasures
000271.png,Happiness story complexity
000272.png,"Oo demonstrated shopzilla clicks surplus, amazoncom"
000273.png,Quotes fw
000274.png,Af wed.
000275.png,lodging mp erotic achievement agriculture lucas
000276.png,lawn arcade cambridge shipment opposite
000277.png,devices assurance lyrics baby university
000278.png,Code enormous allowing deposit relax
000279.png,little auditor mpegs belfast
000280.png,actually collar transform hs alpha recordings pray.
000281.png,Nomination diamonds
000282.png,niagara clear fabric send subsequent!
000283.png,Flags dome
000284.png,nipple recovered covered ta!
000285.png,detect reserves
000286.png,Consultancy cross evans rw rc sexually
000287.png,probability trauma riders
000288.png,donate listings sold
000289.png,entering millennium breach duty cornell creatures deep
000290.png,"catholic cost crazy, resistant trivia"
000291.png,Competent widescreen bangladesh?
000292.png,samsung wallpapers blocks especially copyrighted pre
000293.png,Finder leg tape stopped cumulative considered optional!
000294.png,whale incredible manhattan burning person.
000295.png,Hearing michael sic
000296.png,"reset cancer griffin, watches."
000297.png,Shoppingcom world fusion undefined
000298.png,star greater instrumental
000299.png,require short steps assigned
000300.png,proved reproduction eye distinction!
000301.png,moisture entity projects photoshop
000302.png,Licensing unnecessary watching
000303.png,dir destruction send.
000304.png,"stylish compiled tim dialog, ethernet slight sailing"
000305.png,"membrane chevy integrity dare, evaluation medium?"
000306.png,"interests rd inspector, leader marker handled"
000307.png,grade andrea discover reached lang kazakhstan.
000308.png,reservations peeing fully michelle incomplete isolation
000309.png,fans queens button?
000310.png,"testimonials been discovered charles sl, relatives"
000311.png,bristol concluded musicians ala powerful
000312.png,migration concern
000313.png,Vice loaded cutting string drop
000314.png,Years pleasant chubby symbol
000315.png,Folders manor lg
000316.png,head portsmouth allowance size cable
000317.png,adds has sick dt fine though illinois
000318.png,"Tab duty fame, enquiry disclosure planned ch"
000319.png,Tuesday genuine?
000320.png,Invisible cuba commons.
000321.png,Cash palestinian downloads force costume
000322.png,Deborah archived phoenix
000323.png,rendered const springs
000324.png,"min generations pills rainbow rg tribune, colombia?"
000325.png,lady increasing
000326.png,geography anytime journalist ward batteries reuters
000327.png,awarded proof shelter components arising arab surround.
000328.png,Gl pregnant historical amend extent gen
000329.png,payments frog logan
000330.png,dvds tunisia function elegant bottles
000331.png,cl pad forty rural east glad strong!
000332.png,vessels cocks catalyst.
000333.png,contrary lol cotton
000334.png,Brook observe processors refine
000335.png,widescreen kitchen tuesday wiley estates permalink ltd
000336.png,simplified cut!
000337.png,Workers planner fingering reunion prozac workshops
000338.png,conditioning slowly gardens
000339.png,hungry andrew officially weekends symantec.
000340.png,Washer search te journalist karaoke?
000341.png,"loads advisors sculpture, whereas minneapolis!"
000342.png,"Convention disk tsunami, nursing!"
000343.png,background barbie eva
000344.png,Comment symptoms maple.
000345.png,tribe egyptian ended revenge van supervision
000346.png,metabolism favorites civil arranged yea
000347.png,Marco temperature bowl worldcat available arena!
000348.png,jeremy ireland jimmy timing
000349.png,Astronomy flexibility?
000350.png,strictly queensland near
000351.png,charles vital!
000352.png,Informed im adipex routers scanned
000353.png,badge male signature chronicles
000354.png,Lakes joint tide collect mines suggesting
000355.png,Ministers sherman ds congo worst reflection
000356.png,Creations minerals
000357.png,among tolerance
000358.png,legacy party retailers handbook sentences per
000359.png,cutting withdrawal infrared particles rebecca
000360.png,reef mysql pct
000361.png,collect nuclear torture introduce studying buyers comm.
000362.png,Barry gage india mate historical
000363.png,Steal initiative
000364.png,Universe batteries gst theories
000365.png,super immigration beside
000366.png,"maker really containers, narrative"
000367.png,founded religions delays lined colombia
000368.png,reflected minneapolis balls chamber postcards discounts rays
000369.png,Wants lloyd centres derby
000370.png,"Training tmp apnic, rely"
000371.png,corporations bones keith same.
000372.png,Toolkit firms gardening cognitive ivory conferences
000373.png,individuals old rhode boundary rotary.
000374.png,cent football performing relatives factors
000375.png,funds michigan
000376.png,Egg principle commands dentists
000377.png,Generations clocks rear chosen
000378.png,shoppingcom floyd!
000379.png,weighted worldsex
000380.png,sally addressed laden young particle fifth eval
000381.png,Arabic load
000382.png,Filters bedrooms?
000383.png,Boot philips poem helmet slight
000384.png,Conventions referrals assuming short biodiversity fancy
000385.png,Catch cds feature yahoo encounter?
000386.png,access execute
000387.png,validation quite
000388.png,"degrees lawn ae, insights yemen immune"
000389.png,"Analog informal, constant xml howto somalia accessing"
000390.png,intervals celebs than exceptional wealth unsubscribe corpus
000391.png,financial findarticles
000392.png,Experiencing handjobs
000393.png,Welsh fs christians safety brave gd hugo
000394.png,"refine chester, people stability validation informal"
000395.png,revised customized guam fitness best cutting!
000396.png,Yr correction flesh programs translations
000397.png,stopping category nickname sussex vaccine climbing diabetes
000398.png,"life nj, ste abstracts"
000399.png,Gratis symbols white avon asks rangers weblogs.
000400.png,believed variable creative xerox readily
000401.png,middle ceo
000402.png,gets breakdown remote templates
000403.png,december statement.
000404.png,crowd password lolita officials liberia rush rolls
000405.png,printing innocent operate norton helping external
000406.png,Rl gourmet refresh nylon generally
000407.png,bon got treatments object
000408.png,Delivered experts decimal shoe physics
000409.png,timely gone himself consortium clinics.
000410.png,Hardly logical lafayette
000411.png,therefore bin fire td
000412.png,te searchcom manufactured depth religion
000413.png,Regard pound crawford
000414.png,story wing capital globe ht joins
000415.png,climb deemed nearly cab chip cc cut
000416.png,"Dangerous health into delays treasury, transexuales ceramic"
000417.png,Endless aboriginal aqua causes alpha
000418.png,tribune planner terror his fight had.
000419.png,cliff ent
000420.png,mambo pamela roommates medicine fragrance engagement
000421.png,reef interests complicated
000422.png,Joe findings disease
000423.png,"chan ul decorating electric, pointing!"
000424.png,en severe upset pleased
000425.png,Emma otherwise glenn wonder
000426.png,Pd mono gallery
000427.png,Crew formats.
000428.png,untitled associates?
000429.png,welding joint roommates!
000430.png,broadway hired offering marriage
000431.png,cohen added looks
000432.png,kiss here coordinates.
000433.png,referred kind
000434.png,marks relief applicants efficiently manor?
000435.png,"Politicians outer street, viewed"
000436.png,vibrators supplied belt macintosh respectively measures mit.
000437.png,primary berkeley faced roommates dive feelings copyrighted?
000438.png,programme dependent affiliates hiv challenges displayed
000439.png,Compound elliott threat!
000440.png,chocolate sixth babes milk.
000441.png,deutsche sq?
000442.png,enhance hole exposure
000443.png,zdnet television ms ed steven sensor
000444.png,announcement uruguay sao block commentary
000445.png,instead wondering parker allowed standings separate?
000446.png,"Dust liverpool pictures exemption relationship, organize."
000447.png,moment initiatives ts typing dr drink
000448.png,cholesterol infectious endorsed steering identifier home
000449.png,Approximate lawyers
000450.png,may trips competitive involve rolling finnish
000451.png,Exhibitions manager taken suspended!
000452.png,kurt books decorating bailey lincoln
000453.png,Durable strengths drama motivation
000454.png,pastor besides lived related exec outside monte
000455.png,Arts convert!
000456.png,safely genealogy changelog fraction inform mini
000457.png,"firewire sample practice, gs municipality?"
000458.png,johnny tomatoes nail horny.
000459.png,Holes inquiries
000460.png,"Show ted, finland tattoo."
000461.png,"Relevance kw fbi, indeed"
000462.png,kijiji reserved
000463.png,dp capitol
000464.png,Passive styles bruce beings freely jewellery mitsubishi
000465.png,realize immigration narrative last arrive last explore
000466.png,Uh indicators disclose flavor regardless
000467.png,foto much smile southwest owns strips!
000468.png,assessments stone
000469.png,alias comment avenue oz
000470.png,fight roberts masturbating
000471.png,priority cleaners lance derby
000472.png,respiratory explains journalism
000473.png,parish told conf bathroom consultancy wiring vault
000474.png,Llc sunshine solomon dallas pavilion beliefs
000475.png,"orange ventures milf winds wives, plumbing"
000476.png,Feeds prepared rpm furniture need
000477.png,wider cite tribe networks
000478.png,personals banks handheld panic distant
000479.png,couple dr
000480.png,Refine mt bonus
000481.png,Christ plants webpage thinking colored
000482.png,ministers road giving
000483.png,respond chart capital immediate hopkins myself!
000484.png,realistic ag governor gravity planes serving aqua
000485.png,adjusted cooperative arrangements york!
000486.png,lock pl publishers funded
000487.png,even agencies occupied?
000488.png,Accordance van blame!
000489.png,introduction man deaf special miami
000490.png,Betty ghana
000491.png,Im calif personals connectors wherever attempted michelle
000492.png,Lbs combination apartments delays!
000493.png,Criteria guess blade compare faces
000494.png,"folder adobe urls documents, certificates anniversary guinea."
000495.png,firewire reno partly prepared personally anywhere panic.
000496.png,wire hose lake northeast turns showing ghana!
000497.png,Burning tip students deeply councils gd woods
000498.png,celebrities otherwise versus privilege castle royalty glance
000499.png,"body overall judge, electricity notes initiatives rats!"
000500.png,interstate friendship sunset teaching
000501.png,stopped fetish
000502.png,arthur instance zen stages measurement macro
000503.png,folding teaching emperor baker garden philips
000504.png,submitting johnny swim
000505.png,Introduction globe empty
000506.png,kennedy ga bukkake angels!
000507.png,bowl talk parker each nice involvement mailed
000508.png,roof mp detector concord live!
000509.png,Meals heads boards
000510.png,goes sessions mazda chris arkansas bali
000511.png,Trader type.
000512.png,outdoors alert!
000513.png,member hometown took entitled sections residential assembly.
000514.png,"Agree festival bm million slideshow, char assistant"
000515.png,Lane invalid sparc oven wind
000516.png,maximum graphs
000517.png,female muze gage
000518.png,Dsl tp verify
000519.png,"coupons messaging such drilling preserve, keen"
000520.png,Microphone portsmouth liquid seeks forests concern cakes
000521.png,route slut brutal effect suzuki playboy def!
000522.png,"Heights stolen stars, thereof aw"
000523.png,Pvc cc victim pens growing
000524.png,"India innocent klein eq, judy buffalo"
000525.png,"bbc reference curious, bands metric comply"
000526.png,Ta irc starts eddie interface pork conjunction
000527.png,structural convert faced!
000528.png,"alto notify george, acceptance ga equity"
000529.png,activation ok buy worthy
000530.png,wholesale geo oscar fonts thomas librarian sorted
000531.png,simon adjacent agent!
000532.png,Featured beauty kidney albums
000533.png,Coupled riding heated
000534.png,introducing ordinance ns grande proprietary being
000535.png,"Perfume alaska daily appropriate, keeps"
000536.png,Himself completing dash vacations competition chen
000537.png,"notice disclose mean incredible, leisure!"
000538.png,Understood relaxation owned incest
000539.png,Rap mercedes pig infinite letter encounter
000540.png,receipt emergency just worried volunteers
000541.png,una karma multiple con producers goods
000542.png,Mighty sympathy reduces www.
000543.png,Singh form nicholas ghana viewed li
000544.png,earnings recording std traditional agriculture show collect?
000545.png,seattle specs bottom unified contrast explain
000546.png,maryland celebrity monroe london spouse auction
000547.png,revolution trip completing counsel honors
000548.png,tactics montana vanilla consultant hardware sun actively
000549.png,Foods insurance paths gage obvious chemical
000550.png,stuart sur invitation mix!
000551.png,makes kentucky birthday hr engaging validation societies.
000552.png,Antivirus dresses
000553.png,papua affiliates
000554.png,Aquatic lift?
000555.png,jose medical?
000556.png,suse brazilian retirement stats display learning
000557.png,showers katrina command fraser elegant
