010092.png,launches sync jury buying gm replacement pork
010093.png,affairs robot benchmark
010094.png,hills toward
010095.png,arrives go previously wearing potter cove
010096.png,Nsw laugh limited rosa beast estates injured!
010097.png,Routing om syria
010098.png,killer habitat buy mardi telling?
010099.png,fund cameroon
010100.png,subscriber cathedral oct informal comparable proceedings
010101.png,intro ours peers ac dresses barrier
010102.png,Spirits distributor childrens
010103.png,"tvs ann, locations positive?"
010104.png,opposite picks?
010105.png,waiver fairfield partner fuck
010106.png,Arrow successful
010107.png,pen public car diabetes
010108.png,reid ok afternoon surround disclaimer prophet
010109.png,several breathing many media unlimited forge slowly
010110.png,Reduces appeared throws
010111.png,aberdeen jets tee constructed entirely?
010112.png,Burn brick?
010113.png,dts dropped
010114.png,respected alexandria lucia internet io scanning honolulu
010115.png,Metropolitan rise detected jj mentioned
010116.png,proposition responses count raises spread bracket dat
010117.png,"elizabeth cognitive cap intensive, ppm"
010118.png,abandoned hungarian latter hint cleveland ccd academy?
010119.png,interface generator plate
010120.png,minimal gates
010121.png,jose collections religion politicians company composer
010122.png,gm refuse construct maybe equipment reducing bikini
010123.png,Dock nat
010124.png,look strength weather
010125.png,Super hon complement longer neither clark majority
010126.png,were muslim
010127.png,jvc blowjob blocks.
010128.png,ended payroll stud base citation insight
010129.png,Hazardous inter andrea
010130.png,tobacco vote ssl tn browsing
010131.png,"dish clip, piano functioning empty"
010132.png,dam milfs fiscal importance conventional
010133.png,const minerals spin quick
010134.png,accepting reporting crops colors
010135.png,pounds deeply
010136.png,dis rape peoples cj!
010137.png,Hispanic ri john essays family rings
010138.png,transit concerned ownership bali literary cancel electricity.
010139.png,Attendance occasional releases edition assessments
010140.png,phd gui addition nudity buried safely concentrate
010141.png,Attempted illustrated news brazil sheet vatican?
010142.png,should moment acids wizard
010143.png,"almost narrative, mv attempt firms reviews impossible?"
010144.png,"Clinic pdas crisis bryant smooth, life creates"
010145.png,Senators lake nil british
010146.png,"saints lying, imports residence spears"
010147.png,Power cancelled decision graham programmes elimination preceding
010148.png,"Italy browsers, until carpet"
010149.png,keywords appearance ate
010150.png,Sq violin victim noon cbs
010151.png,cowboy matthew movements backed tall
010152.png,Fare influences web anxiety searching arranged climb
010153.png,Subscription movements!
010154.png,walks ozone worldcat?
010155.png,phrase freelance riverside egg content sensors
010156.png,Floral asset windsor spaces shooting
010157.png,Nevada ata
010158.png,Object metro basement cloth propose
010159.png,"christians rio aberdeen owen, lightning included."
010160.png,wt overhead
010161.png,depot organisation dui major
010162.png,forge liked
010163.png,"Anna blair, barry cooling jazz access compiler?"
010164.png,Extensive relatives west stream crops password largely
010165.png,dump omaha knit cayman pending systematic soonest
010166.png,Publishing downloadcom trends percentage
010167.png,evil convenience
010168.png,indirect board britannica conflict
010169.png,Principles massage interactions received labeled
010170.png,august launches oct
010171.png,Flavor billy sw reviewer parameter delegation sent
010172.png,caps conduct climate?
010173.png,forbidden disciplines
010174.png,Defence surge apparel mods decline promoted gi!
010175.png,prime dare universal utilize bubble are
010176.png,marie arguments bag murray
010177.png,Toys timber spring
010178.png,cancel destroy lets!
010179.png,crazy previously polymer thinking sbjct pound exchange
010180.png,milfhunter bomb competitions buttons tragedy countries mu
010181.png,score campaign
010182.png,Britain panasonic pit revised assets utilize stocks
010183.png,Convicted dancing player sierra sucks
010184.png,Sharon miller spam respect perspectives
010185.png,Findings username electricity arranged sent waiting
010186.png,texas roulette naturally accounts co discounted revision
010187.png,Ur worry planes he!
010188.png,Sides labeled springs dildo founder
010189.png,powerful piece consent
010190.png,indexed mineral terror reviewing sitemap.
010191.png,barbados generator
010192.png,eden horizontal some division nationally encyclopedia
010193.png,Georgia cst medicaid mexico.
010194.png,recordings carey guinea covering turn
010195.png,broadband voices judgment quarter
010196.png,sarah laboratory flour calibration hawaii zu
010197.png,Collectibles elliott obtained pubmed terror stayed
010198.png,berkeley list walk year.
010199.png,"ia truly, silk withdrawal"
010200.png,tigers happened biggest speech mt admin scientists
010201.png,Borough alcohol announcement olympic database controversy
010202.png,"rv calls industry fisher bloody, rainbow mike"
010203.png,ash navy!
010204.png,wi ps pool thumbs visited fax?
010205.png,century fare
010206.png,reality expanded hands.
010207.png,sie aaron
010208.png,rap tribal wines originally typical
010209.png,Image head sides floppy resources
010210.png,publicly mostly jill patch jm showers!
010211.png,abandoned seeds skilled
010212.png,lands seats britannica tactics dry
010213.png,df kitchen.
010214.png,In bars.
010215.png,Jun underwear joint every weeks
010216.png,tight melbourne wives?
010217.png,consumer vernon coupons presidential pull filtering
010218.png,canvas alex!
010219.png,strings panties legislative bottles
010220.png,coin vacancies zu distances each moms appointments.
010221.png,Her come outdoors gray offers harvest availability
010222.png,"paste man, motivation wherever traditional timer?"
010223.png,"department round appointed telephony southern projects, latino"
010224.png,Anti berry
010225.png,another superior eye developer lite hull bunch
010226.png,avi merchandise
010227.png,sarah long quest hammer
010228.png,Prime tube packaging
010229.png,"Dressed dresses, pdf leads hat silk christianity"
010230.png,Legs unknown.
010231.png,divx refund hwy printable bean bloomberg skill
010232.png,johnson councils keeping indian
010233.png,Facilities error charlotte chevrolet warnings goto remedies
010234.png,efficient vessel ar looks owned relation
010235.png,"Cellular michel newspapers hang carb dependence, locations"
010236.png,mechanical yen yet!
010237.png,lying binary
010238.png,commentary panels swiss rx acute loans sh
010239.png,drew teacher za
010240.png,nipple filled.
010241.png,picked except never syria en lamps?
010242.png,"Pic forests applicants, garcia junk"
010243.png,dial receivers
010244.png,"clarke leadership prayers, bottles bt"
010245.png,Sandra jason children
010246.png,Rental src champions!
010247.png,"before southwest abroad, instruction"
010248.png,studied chronic
010249.png,apart understood competitive.
010250.png,mh harvest necessity cancelled non catering
010251.png,Shelter mail dense
010252.png,Change greeting?
010253.png,Raising sector ethical sublime
010254.png,reservation perth curious routing
010255.png,lucy nation organic?
010256.png,suzuki surge variance therapeutic sample wines
010257.png,cigarette singles ya relaxation.
010258.png,Conclude inline nsw respected german remark
010259.png,famous buttons worlds fancy
010260.png,sellers challenge belt heater thailand
010261.png,Budget referenced cj bacon?
010262.png,charms hazardous scenic bound learners signed
010263.png,Continues somewhat physiology.
010264.png,arguments mixed purple
010265.png,weights foot passwords duo lawrence pool
010266.png,Marco strictly sells
010267.png,"elephant discussion, artistic bible"
010268.png,Absolute finder pa
010269.png,albania relying
010270.png,discrete empire foo!
010271.png,Seem seven faqs scenic how
010272.png,Greg treated combining boating edition
010273.png,nt participants
010274.png,travelers visibility sheet footage
010275.png,Initiatives declare slope stones
010276.png,"Survive dimensional unless slovakia who, isolation mechanical"
010277.png,delay engineer humanities rv equations neutral
010278.png,slave names hugo sandwich
010279.png,Oxford radios junk ntsc preparation island migration?
010280.png,Derby second concord equity dial perspective!
010281.png,chrome along describe desired
010282.png,"subsection honolulu, bras somerset du"
010283.png,humanitarian journal folks signals brooks.
010284.png,virtue expensive
010285.png,opened brochure entire trust rolled reasoning
010286.png,reprint target shakespeare satisfactory denied
010287.png,Hotels audi occupation male til revenge damage
010288.png,imperial isa polar rrp
010289.png,reproduction fixes imposed illinois application chemistry planners
010290.png,"Describes accessory, lens himself bicycle."
010291.png,"wanted expanding, fighting pregnancy"
010292.png,compaq hazards six youth achieve
010293.png,reseller craft productions lock hormone immediately
010294.png,Hockey simpson
010295.png,wound accomplished voyeur appreciation passes
010296.png,Exit albania?
010297.png,calm ford soma doe europe download
010298.png,accounts pi?
010299.png,Nickname hosts.
010300.png,curve london
010301.png,fingering genre rwanda given
010302.png,maryland retrieval transmit hotels bank deleted
010303.png,Promises builds ambient reload jar?
010304.png,some hdtv alternate
010305.png,physics cottage gbp competitive exam
010306.png,de mailman or joe
010307.png,shanghai sector taxes
010308.png,ordinance trace killer housewives.
010309.png,albania execute
010310.png,sandwich sit ids satin focused thermal!
010311.png,build cams
010312.png,va licking hugo
010313.png,Decorating guards federal cooper?
010314.png,Metallic institutions om texas
010315.png,painful describe bowl colors sync job
010316.png,Destinations receives dvd growth terminal
010317.png,Germany city auckland led apparatus loading remind
010318.png,Meat unavailable servers attempted server long stop.
010319.png,Afraid disease comparative motion worried matching smile
010320.png,Boxing baseball architect archive loving alphabetical
010321.png,doe ps carry eventually protest stakeholders
010322.png,paperbacks handled thumbs accessory bind
010323.png,"prescribed translator, techno edit maui gnu"
010324.png,Sublime pr pakistan who weapons nascar
010325.png,voice libs rebound grill promotional nyc
010326.png,"cio whale, golden tracking."
010327.png,spanking commercial experiment theorem incoming.
010328.png,diagram scheduling transparency fucking nat welsh.
010329.png,Wins melbourne ambassador handle escorts melissa!
010330.png,"strange prize, minnesota she!"
010331.png,replaced postings cow shipments april october require
010332.png,stationery suppliers hopefully rack
010333.png,Dining pupils occupied movements
010334.png,peeing retrieval macintosh
010335.png,couple prompt born introducing half listening?
010336.png,Edges piss reef girlfriend
010337.png,tanzania wonderful
010338.png,museum factors
010339.png,legislature accessories
010340.png,crafts squad contrary inputs?
010341.png,remarks pet packed lead
010342.png,"remembered awards, stopping collectible"
010343.png,Satisfaction miniature fire xp mineral criticism
010344.png,exhibitions irish cage
010345.png,Teach officers wet apparent colors advantages!
010346.png,Formatting deer revised
010347.png,toner ruling perfect
010348.png,Gossip aspect explicitly modeling republic landscape sequence
010349.png,colony qty neo reality band pierre losing?
010350.png,royalty masters endif
010351.png,packs favorites showed tattoo
010352.png,Posters adam delay remainder brother appeared criminal?
010353.png,Louisville stat half
010354.png,Ac unique sub registration!
010355.png,paste jp lf eyed however gi
010356.png,army convention ul provinces writer priced
010357.png,edward syndication directions electronic
010358.png,sporting nail danger ae texas!
010359.png,Terminals architecture placement bases
010360.png,junior reference watson
010361.png,forest central senior brick quote reel
010362.png,guitars dealer projection waves iraq enables flexible
010363.png,challenge mothers anchor controls.
010364.png,Drove mercy?
010365.png,bass employed trend.
010366.png,maple lifestyle cause
010367.png,"crown independence, transcripts mistress jo"
010368.png,"fp allocation early ob, morning mrna."
010369.png,victory fold snap
010370.png,accounts uganda romance suddenly employers consumers isolated
010371.png,item outer samples moves goto
010372.png,bi rat transparency later cakes
010373.png,"along wisconsin tiny, achievements"
010374.png,linda logistics
010375.png,sms dryer eugene able sandwich ensures
010376.png,Omaha presentation
010377.png,Restrict thu
010378.png,elements plugins portable os.
010379.png,henderson truck
010380.png,raising chairs highs deposits theory joe
010381.png,slave swedish pan parenting?
010382.png,governance remarks territory
010383.png,Indices indicating danny flex gov
010384.png,greetings blade precisely
010385.png,Trap noise my
010386.png,aspects appendix suggests follows addresses
010387.png,Ought entering claims ti entrepreneur salt
010388.png,Began silence reply
010389.png,cox shooting seem ps co.
010390.png,statistical en spell
010391.png,greetings decade yang volume costumes.
010392.png,"maryland legislative awesome programming, comes"
010393.png,Equal going croatia.
010394.png,technologies foul summit praise brunswick
010395.png,Accurately voip readily routines citation males
010396.png,"Abilities sagem, hopefully lies termination wordpress"
010397.png,sensors affiliates itunes assistant observation crap selections
010398.png,executive excluded hang reputation caps proteins thumbnail
010399.png,"fake trucks, democrats anywhere thickness"
010400.png,colony jr balanced snake advantage cells allowing
010401.png,"nu sustainable type med billing test, canal?"
010402.png,tax kde protecting
010403.png,bride fist morris fucking!
010404.png,Beginner quotations seminars
010405.png,paraguay visa volkswagen honor starts recruitment scripting
010406.png,incorporated appointments filtering boxed
010407.png,poker cms watson beans muslim individuals circuit
010408.png,Agrees insert arrange farming
010409.png,appreciate explosion uh awful bye
010410.png,composer omega
010411.png,protocols cs adjacent!
010412.png,Siemens surrounding constraints finishing argument
010413.png,receptor structural?
010414.png,la xxx accused techno
010415.png,fraud recruiting mixing td reasonably
010416.png,ensure electro marking
010417.png,East donations
010418.png,Underwear intention expenditures then sweden compatible contribute
010419.png,sleeps inspections marks readers
010420.png,chocolate answering promised documents sku protective ate
010421.png,supervisor mention.
010422.png,Wars dumb supporting ratings
010423.png,settlement incomplete involvement college wal checks sucks
010424.png,opinion been nova
010425.png,Correctly webster aug some spoken
010426.png,Evaluating brain sage sans randy hunger dinner
010427.png,"Answering undefined huntington arrest, connections dig peer"
010428.png,offering enquiries recipe extreme pole cohen cleaners
010429.png,Favourites broader student
010430.png,fear labor pen genes producing
010431.png,later lenders gpl headers rope via.
010432.png,addressed forming worn biz equipped four
010433.png,microphone massage motorola
010434.png,steal team?
010435.png,Cw reprints photographs?
010436.png,speech tablets networks measure intelligent german!
010437.png,printers vegas
010438.png,Blogger beast administered jackson
010439.png,contributed fleet evaluate largely butter mad stock
010440.png,carnival appreciate scored dui declared cave punch?
010441.png,Cube voltage balanced seminar charging myrtle!
010442.png,based qui!
010443.png,fotos comment bufing?
010444.png,Profit vip takes schedule rick invited!
010445.png,ng blacks collectibles
010446.png,deep to
010447.png,constitute darwin hired race francis cr
010448.png,Card marketplace sheets magic issues implications hb
010449.png,Sustained sites presently burton
010450.png,focal rj safer conversation binary.
010451.png,Ppc highs linda
010452.png,alabama navigate selection
010453.png,dirty gossip patent construction epa
010454.png,English from fathers dust suit pills visual
010455.png,related lol homework medicines gordon our classroom
010456.png,Bloggers vegas nearly smtp
010457.png,adoption threats delegation?
010458.png,funds reception olympics.
010459.png,md reads hurt phrases magnet
010460.png,telecom experiments monster agree steven
010461.png,skill herb!
010462.png,Ticket roommates
010463.png,donated maintains graphs
010464.png,subsection adoption soccer cadillac
010465.png,Canyon rows geology
010466.png,"Twinks breeds, evidence guide papers."
010467.png,zone bound
010468.png,"Arch hunting, moral bureau"
010469.png,iraqi bizrate hz paso weak?
010470.png,"yorkshire slovak pichunter lawrence, blood excluding ebook"
010471.png,completely lose trailer.
010472.png,Midlands blogs folders helps mod!
010473.png,Ws spoken refinance warning
010474.png,analyses sold site
010475.png,Outer ts grows instant poems thai?
010476.png,Loc learned
010477.png,Basis versus wife nipple canyon reasonably
010478.png,"madison replacement, kick arrested gained?"
010479.png,"sub safari sender, mere nationwide"
010480.png,"touring tube one rip, butter"
010481.png,eminem reproduced finals
010482.png,"Html optimize, boys rider prof"
010483.png,incidents mcdonald scoop broadcasting
010484.png,entirely starting mines etc la
010485.png,"Board forbidden expects wanted, epa go"
010486.png,judicial affect trustee calibration rounds beats electronics
010487.png,john pickup able repair
010488.png,"compound proposed academy attribute, accordance"
010489.png,religion require
010490.png,Movie lil hz latina
010491.png,Jacob egg pre surrounding cut
010492.png,tions overhead drawings eddie convention came museums!
010493.png,Cn broad variations stevens mm
010494.png,"Orchestra wire delegation, girls"
010495.png,measurement wallpapers steel.
010496.png,Come boxed jim
010497.png,recording decorating consist preview kinds
010498.png,pointing temporarily malpractice
010499.png,stamps light upskirts involvement
010500.png,secondary multi spell kansas passes
010501.png,Innovations reducing?
010502.png,referred pediatric barely spice wondering overcome limit
010503.png,returned consultation depth saint
010504.png,industrial prison
010505.png,Swim permissions misc
010506.png,Came ou
010507.png,welfare margin okay annoying
010508.png,Rn consists afford smilies
010509.png,"boating expanded, extract lean yoga al"
010510.png,Boxes bass continue got
010511.png,stretch pond sauce kay counties yourself started
010512.png,numeric opt lat damn bullet houses
010513.png,parameters bd encourages shareware
010514.png,vehicle higher subject rochester char persian editing
010515.png,Ratio southern annotation str ass butts
010516.png,Pot examples camps flux!
010517.png,ignore bloggers portsmouth
010518.png,Feeling chris objective platform
010519.png,belongs mothers
010520.png,lifetime vi cp acknowledge rational maintain fingering
010521.png,trip automation thousands chapel
010522.png,jane import
010523.png,"Hungarian chancellor participated products, publishers belkin budapest"
010524.png,Causing highways gloves textbooks reynolds newark fails
010525.png,outputs delete pour movies bw postage
010526.png,"ecological occurring, yearly italiano"
010527.png,hampton guest tackle botswana being waters
010528.png,"captain booty, jeff secondary learn"
010529.png,cumshot mentioned extremely conceptual appendix angola
010530.png,launched licence training alignment assess lakes
010531.png,Shaped proved taxation extent advertisers ta cross
010532.png,continue asked cl middle inches calculators.
010533.png,rear distribute
010534.png,"playstation bracelets, diamond aka"
010535.png,Biological medline
010536.png,Informed eye binary nail toshiba prague psychiatry
010537.png,Wrestling fires eh alexandria
010538.png,Clusters windows refinance ala flower
010539.png,elect cnetcom proteins eve examples challenging any!
010540.png,"bedroom ie roads thumb store, duplicate"
010541.png,Inns forgot
010542.png,workflow expects ferry vb?
010543.png,disabled agency
010544.png,admissions limits attached salt position distributed
010545.png,taught ejaculation
010546.png,"god karl ferrari destiny, learn."
010547.png,Womens amd effect dirty control chess?
010548.png,amateur reminder headers
010549.png,happens unwrap beginners careers eleven diamonds orlando!
010550.png,gone fall turned
010551.png,along min athletes sometimes serial tomatoes
010552.png,particularly languages
010553.png,Sandy quick staying gdp changing lit
010554.png,magnificent teacher refer pit britannica orgy
010555.png,Sound islamic crown
010556.png,formatting governments difficulty homework
010557.png,Females superb subsidiaries tahoe
010558.png,unlock node polymer eligible
010559.png,Towns vpn thursday became trash dig
010560.png,turned sheet section?
010561.png,adjusted ipaq closer plaintiff.
010562.png,Rachel heading owner continent timber instant florida
010563.png,Extend increase
010564.png,Ipaq adequate progress involved promotions exclusion!
010565.png,"maui was denver non coffee html, fingers"
010566.png,thought legs
010567.png,Lighter puppy
010568.png,Range committee weblogs lopez farming albums squirt!
010569.png,maximize date photograph cock slide passengers potato
010570.png,Replies diff plots focusing halfcom
010571.png,tampa picking coming cl decimal corner extras
010572.png,"plate gourmet, gov georgia circle"
010573.png,wars acknowledge rounds consultancy atomic item manage
010574.png,timing isolated criterion
010575.png,easier pursuant!
010576.png,rendered trying told promoted
010577.png,Bo realty psi jm bloomberg advertising?
010578.png,indirect recorder dog desert annual
010579.png,Beds difficulties
010580.png,hands central rochester collar
010581.png,awards pty
010582.png,westminster doll morning jeep common
010583.png,Sensor it cardiac mountains organic synthetic
010584.png,"activation demonstrates dome, bare voices drives harvest"
010585.png,"Mining james, account insects chef"
010586.png,indicator silk colombia apart bacteria feeds
010587.png,builder from hitting important integrated nursing
010588.png,location decrease sort feeding production celebration glasses
010589.png,wallace entered favors running ef quite ana?
010590.png,pins ships portable
010591.png,vid align ml confusion usr rural
010592.png,impacts tube
010593.png,Fundamental bears sage accused iii sen airports
010594.png,lawyer picking into morning principles!
010595.png,release actors bra looks stats attract?
010596.png,"mitchell notion thick living, rfc winston"
010597.png,starter compiled blacks tunes themes mountains enormous
010598.png,Ski calif
010599.png,san mrs electricity located hose purchases
010600.png,minds adidas ton suite?
010601.png,Boutique foreign anger
010602.png,"function mainstream, global mumbai committed cherry!"
010603.png,inexpensive supporting pj mac bowl
010604.png,desert suits trusted redhead guinea
010605.png,"Identifying caribbean accordingly, saves peninsula"
010606.png,Five daily guyana
010607.png,Lower shopping
010608.png,indicating graham beef england first missing
010609.png,portugal cnet inspector accomplish raising it
010610.png,Jordan perceived decided calculators civilization albert
010611.png,suite juan super
010612.png,Deutsche entrance currently reward
010613.png,netscape decrease?
010614.png,hitting sucking meanwhile ratings july pamela.
010615.png,assurance prepared food wi terms runner died
010616.png,hearings quotations disorder florist.
010617.png,recipients plants hitting gzip lottery?
010618.png,Ni una someone regulation
010619.png,Hung avoid
010620.png,Checkout jade optics coal resulted?
010621.png,Maine civil prescription format accompanying.
010622.png,merely czech wagon ranch harassment crown starts
010623.png,amend memory result mrna.
010624.png,"Surf delegation cents, viewed?"
010625.png,ignore aircraft cordless met
010626.png,watches locate institute highlights
010627.png,Adrian arcade throwing bermuda ve alliance
010628.png,up monitored indices
010629.png,dirty orgy agents poly rosa civic stones
010630.png,Properties again.
010631.png,complicated wives politicians bring fi hosted
010632.png,transfer original.
010633.png,token hz cest recruiting agents
010634.png,Ha southwest cartoons
010635.png,steps lie rugs cool finished
010636.png,deficit trying bars saints
010637.png,expected nhl hydraulic diamonds
010638.png,gp adjacent.
010639.png,local stainless
010640.png,Printers databases structure faced federation albert breach
010641.png,Necessarily attraction helen
010642.png,yourself involve just ministries ourselves berlin kodak.
010643.png,und immigration microwave!
010644.png,tabs arrange ja focusing colonial vacation relax
010645.png,Seven fiji rs
010646.png,electrical linda ronald commercial?
010647.png,tap kirk par
010648.png,"Airport seekers, resist olympics"
010649.png,community comedy
010650.png,trains hot talent greece rings radio
010651.png,arm hardcover ft
010652.png,olive discussions arrest
010653.png,notebooks observer geneva
