005025.png,defects dice biology northwest companion
005026.png,sig thriller crops achieve depending prizes settings.
005027.png,Divine quantity itself rover occupation savings
005028.png,electoral surgeons dem biblical detective
005029.png,packs stick lying newspaper lips strengths landscape
005030.png,titanium ham their usr tx competent launched
005031.png,guidelines wall
005032.png,strongly mobile specifies agrees meter vcr
005033.png,laid uk
005034.png,"suspended applicant val, american influences!"
005035.png,Promising montreal reporting enhancement aquatic cant badly
005036.png,Guided survivors legitimate.
005037.png,ministers settlement gourmet fees.
005038.png,slovak tin
005039.png,prospect cd tsunami.
005040.png,Obj foundations portuguese
005041.png,Sara spirituality vegetarian low.
005042.png,anime surgery
005043.png,variable cb evanescence flooring global german subdivision?
005044.png,Wins blair selection ties recordings!
005045.png,villages jesse humanities
005046.png,vsnet departure peaceful dispute roses assumed
005047.png,terrorist persistent
005048.png,break goto activation choir small knock.
005049.png,emma initiative proposals
005050.png,vg exceptional passes legislation
005051.png,figured anderson nepal amazon beads pan
005052.png,Various gamma
005053.png,causes after
005054.png,Annie bon jordan secure constraints
005055.png,harry prepare.
005056.png,"sharp forms identified verde, inventory targets station"
005057.png,climate world hartford
005058.png,spec watch discipline charter guidelines making start
005059.png,Oops publisher furnished tackle vegas wordpress
005060.png,Intl rankings involves manchester diffs
005061.png,"Rendered rooms, manual alberta"
005062.png,epinions winning make cingular
005063.png,Tiny zinc calendar locations trunk sofa orbit.
005064.png,fridge dawn missouri
005065.png,Edinburgh busy
005066.png,"Fees positive aa, tumor joint chorus!"
005067.png,"humanity ultimately filled dv, conclusions systems"
005068.png,"delete compact, chem brussels corporations nodes"
005069.png,Tunes forgotten capacity
005070.png,Sexuality gorgeous
005071.png,Intl valentine brokers liberal colonial mid
005072.png,Scanners issued
005073.png,Conservation into complex rebound tennessee hoping?
005074.png,"assists sugar mia controlling cube, targets"
005075.png,anal cohen uri strength
005076.png,evidence passage fit!
005077.png,Addressing extraction romance seventh households
005078.png,chairman onto carmen sagem
005079.png,"stress alexander, pamela apnic"
005080.png,lamb arts sells occurred font spending trips
005081.png,resolution construct
005082.png,luther france eng labeled sunrise
005083.png,Pressed experiencing obtaining stable.
005084.png,musician hentai bm twenty?
005085.png,vocals offers travelers
005086.png,amended aquatic keno study platform illegal lloyd.
005087.png,practices cow bridge
005088.png,Mph everywhere
005089.png,Subscribe indiana racial fellowship foreign cause association
005090.png,"mixed kentucky mentor artwork download, error efficiency"
005091.png,fashion rpm ia?
005092.png,Tobago tan actually.
005093.png,canada bradley grande solved overhead
005094.png,zone reference
005095.png,govt usr extends orders rare?
005096.png,Houston pumps keeping feel activation geology.
005097.png,director flat operate
005098.png,gui permitted chapter.
005099.png,regional designated judicial.
005100.png,Julian poet web cl ft dense
005101.png,Powers cet cedar ghz hostels
005102.png,likely lisa ncaa disposal rpm promoting
005103.png,buildings delivery whose robust growth hunting
005104.png,oliver cheat tunnel uc
005105.png,arabia amp entries?
005106.png,Housewares prefix driving christine institutes juvenile sierra
005107.png,enabled park amsterdam
005108.png,rounds indonesia basket our
005109.png,sort sir spas sudden structural
005110.png,Goes von atmospheric boobs!
005111.png,Challenged plus
005112.png,leasing wellington!
005113.png,flour diamonds deer vibrators home experienced hungarian?
005114.png,creatures biol
005115.png,"wiki never, gmbh foreign"
005116.png,mode awful oliver?
005117.png,laptops connecticut enough ericsson towns
005118.png,time legally helen plaza!
005119.png,throat seeks van.
005120.png,Furnished deal liabilities andrew lewis
005121.png,Guaranteed list kyle seminars gage
005122.png,Perth howard adopt hu locking somewhat
005123.png,ste adjust
005124.png,plugins wan evolution voters able gba?
005125.png,Saved fox johnston?
005126.png,Jm invite
005127.png,Treasure infection
005128.png,Talks bio melbourne home females
005129.png,jp advantage collectables expedia houston?
005130.png,"bobby examine, involved trek"
005131.png,fuel itunes!
005132.png,purple db!
005133.png,Broader marine losses!
005134.png,db sublime likelihood sterling
005135.png,controlling incest pete omissions perfect glass
005136.png,Satisfaction gmt colleague
005137.png,Procedure trader
005138.png,Farms vehicle roy myself development tape hockey
005139.png,Set intel.
005140.png,Stages conclusions archived ws reduces detected kerry
005141.png,Disability ruby
005142.png,"Bed galaxy, pose long tft"
005143.png,cooking luxury audit boot nashville respectively abraham
005144.png,offering wellness
005145.png,Springs learners understand redeem subscribe
005146.png,think edinburgh inexpensive kentucky districts shopper
005147.png,hs upgrade!
005148.png,sees extraction brutal authority
005149.png,Currently prison mr likely ko
005150.png,browsing hopkins causes boxing lf
005151.png,cabinets losses
005152.png,Arrange surprise endless theology allocated violent priority
005153.png,City czech speeches
005154.png,pool ease
005155.png,soul guaranteed courts national sub
005156.png,marcus andale grad participant!
005157.png,banners david
005158.png,delivering nigeria nasty spider
005159.png,pressure vibrator salvador halloween nicaragua
005160.png,Gain curves made preceding ranges paid kitty
005161.png,Defines good warrior chaos nails amber discs?
005162.png,sweden generation parish contributors!
005163.png,Thousands ebooks beneficial.
005164.png,Cet fcc python tariff sorry speaking oldest
005165.png,Stadium luggage flame observer physics
005166.png,nat spouse bee
005167.png,shut politicians element earnings lovers planet?
005168.png,Cliff cost boxes dial proxy avatar?
005169.png,Questions mesa turns magnetic
005170.png,definition biodiversity move strategies doors elsewhere street?
005171.png,coordinator declaration freely.
005172.png,"adopted citation, medical romantic!"
005173.png,spell buildings pen arab
005174.png,moore jet panama operated roller
005175.png,conducted teach.
005176.png,"Till enquiry what integration, these parks motel"
005177.png,feed fast concerned proved
005178.png,takes orientation sacrifice bingo shows!
005179.png,norton pressed interference pharmacy wherever trigger scenarios!
005180.png,Retain predict ray.
005181.png,boom avon ssl barrel
005182.png,Pathology accompanied unknown fellow efforts
005183.png,Speak singing preference epic
005184.png,parallel implemented petersburg?
005185.png,bigger atmospheric
005186.png,"begun paper solid, vcr"
005187.png,ash los drink viagra?
005188.png,guests surfing travel copied incidents honors hypothesis
005189.png,Freight global penis instantly
005190.png,cia lou damaged
005191.png,layer several.
005192.png,Explicitly gulf jim math commonly cached.
005193.png,innovative presidential cons vegetable
005194.png,Fires pathology passive songs withdrawal wilderness principles
005195.png,hunt rg twiki mm changes competitors
005196.png,"expressions hundred journalism letter, normally"
005197.png,housing coupons speaks
005198.png,trouble cable relevance
005199.png,lm filing roller
005200.png,catering valve dirt rim horse clean proposed?
005201.png,providence hire itself times worldwide?
005202.png,roommates corps tournaments cuts quotations
005203.png,Prostate players vacations satisfy weather fonts acts?
005204.png,Warren arrangements retrieved decided fabric isle patterns
005205.png,Dir divide incoming passion hollywood myrtle unto!
005206.png,shore contemporary african
005207.png,Hl laboratories warned cgi ibm
005208.png,conventions katie opposed venture arrival fellowship!
005209.png,Cape thehun
005210.png,Lines eg cube?
005211.png,"heading mega guaranteed, elephant height those?"
005212.png,funny pot observation find pride ser
005213.png,"Announce ratio routes differential centers bizrate, turkish"
005214.png,Bedrooms efficiently badly funeral
005215.png,Fig cigarette uniprotkb
005216.png,Carefully marc donors attend
005217.png,"curriculum attend martial civil companion, males views"
005218.png,interest warnings publications apartments herein chile
005219.png,Holland facility regular snapshot accounting salvador ac
005220.png,"Realtors hear guns madison, poem lines"
005221.png,ocean recommend hong differences feb
005222.png,Territory floppy
005223.png,acres dana likes improved thoroughly
005224.png,Particularly initiated junior elvis
005225.png,"onion closes directories paying, eval"
005226.png,disney chairs split
005227.png,Bunch rider jelsoft municipal controlling accommodate strip?
005228.png,summit verified
005229.png,gb figured
005230.png,affiliate package dam dts ne cumshots asus.
005231.png,Sale governance kidney while snow
005232.png,Cumulative arena fp computation winston latitude likes
005233.png,creations licence wound simply inform southwest
005234.png,annotated des baker households!
005235.png,Continent catalogs large
005236.png,Events winning bishop sarah imperial wash
005237.png,Restricted forced ability erotic offices
005238.png,Reward selecting gangbang hose
005239.png,Provided courtesy
005240.png,device enables recipients leads compressed diseases jose
005241.png,helena debut anal!
005242.png,telecom refer intended nat destruction pray
005243.png,infected borough constantly religious copyrighted
005244.png,jpg purpose nurse anne retention.
005245.png,path lingerie profiles da ja
005246.png,mortality estate
005247.png,yours plants machinery guyana
005248.png,clinics drawings!
005249.png,Extreme specialties banking tells randy systematic pts
005250.png,bottle tanks computing diffs.
005251.png,Amp firm internal warrior bottle dice filename?
005252.png,"bm franchise algebra somerset zu, freely"
005253.png,Infected deal thongs
005254.png,apparently stopping top completion rico recorder bluetooth?
005255.png,broad cemetery viii proposals photography composer cluster
005256.png,reef ali copyright cordless
005257.png,Payable message jesus servers
005258.png,"est struggle raleigh telecom, ahead!"
005259.png,politics heavy shock possession algebra
005260.png,individuals clean lil mix stroke
005261.png,Affair beijing
005262.png,Bracelet orchestra accessory persian overview
005263.png,Visitors tiger.
005264.png,greetings aaron projects cream
005265.png,med cst msgstr antonio input kingdom
005266.png,keyboards spent
005267.png,crazy zu az gage total lunch?
005268.png,Ram address underground
005269.png,Foundation earned various
005270.png,"Architecture workflow bradley funds merge, bi."
005271.png,notices delicious mass
005272.png,licensing heavy
005273.png,Bali claim subscribe vol
005274.png,Snap specialty mile layer stainless bracelets leads.
005275.png,painful davis
005276.png,Sure hiking politics focused
005277.png,Carol position groups mine advertisers milton user
005278.png,"ambien dana void arise, bolt charlie pharmacy"
005279.png,Danger encouraged php copies rounds precious mean?
005280.png,"control disaster cats, description"
005281.png,accessory manual cams create nose bye venue.
005282.png,Detroit dad chronicle consultant screenshots attitudes.
005283.png,suggests medications val geek
005284.png,gentle protection reliable assistance self speaking availability
005285.png,smith scenarios searching assume singing hong insight.
005286.png,hwy productivity cottages choir
005287.png,refund warming!
005288.png,ai dialog fields operated buildings pn
005289.png,Msg chen savings app spies convertible simon.
005290.png,Expansys mauritius passwords
005291.png,Scheme maintain coral
005292.png,Ourselves epinions!
005293.png,second kathy horn random midi
005294.png,"blogs necessity digital script thank, highland"
005295.png,Al appeals designation commodity categories
005296.png,salon planner
005297.png,payday sd zones!
005298.png,rover performed hepatitis awards kitty scales
005299.png,Yo laundry
005300.png,"holds columbia, editions cigarette ciao"
005301.png,attract watching
005302.png,crude thou sg relax tours fascinating
005303.png,"matched graphs, them wanted alarm"
005304.png,handheld newscom coupon
005305.png,Listprice links bite ordinary
005306.png,perth violin.
005307.png,decision hybrid
005308.png,therefore merchant
005309.png,Bg beats reads amateur materials examining
005310.png,south vehicles handheld laundry presence!
005311.png,desk elementary devil.
005312.png,ltd interesting plate merchant decisions?
005313.png,Ira defense.
005314.png,literally got shore
005315.png,rare oxford excel shanghai
005316.png,Consistency est attending kelly escorts diary!
005317.png,elementary arthur dir colleges mother extended
005318.png,Individuals dale drawing changes drilling distributor feet
005319.png,Contractor vpn files standards acquire
005320.png,conversion huge railway rwanda backgrounds vsnet
005321.png,clients ping abstract interface afford combine drum.
005322.png,Battlefield diana expired schools highway carpet malpractice
005323.png,pounds fundamentals herein
005324.png,relaxation oak pubs merchandise!
005325.png,Had medicare pick
005326.png,dom crystal openings clicking agent hartford supports
005327.png,Statement titles
005328.png,racks gel reminder antiques deborah weblog loose
005329.png,magical remedies sonic exempt ivory engaging?
005330.png,rca executives footwear east smaller
005331.png,threesome trips wedding
005332.png,camcorders controls heading pressure
005333.png,requiring bother
005334.png,required grass encoding shield.
005335.png,Routes ancient rob picking savage barbados robots
005336.png,crack apparatus?
005337.png,scheme surgeon screening performs leone
005338.png,Retained by ft value
005339.png,headphones account resolved una?
005340.png,prot hist clarity?
005341.png,bar ecology paper betting matters throwing
005342.png,immunology game decade configure brunette departure adding!
005343.png,cdt montana fish combine hartford
005344.png,sand php mental zip.
005345.png,inquiries rules sciences zoophilia icq
005346.png,realistic spotlight reads hot
005347.png,rent sunrise wake pic
005348.png,Jackets threshold cup
005349.png,"myanmar indicating rico, netscape entries jd"
005350.png,"dildo hilton drill, dividend"
005351.png,restoration hugh divisions
005352.png,sharp remix plugin intersection
005353.png,decrease lovers delayed harvard?
005354.png,heights champion nitrogen investigated counted
005355.png,Idol belize intelligence salvador asn mate.
005356.png,monitored frequently buying
005357.png,"Advanced consent addresses wanting br, hiring pull!"
005358.png,mainland additions nato camp housing passengers
005359.png,Mumbai canvas searching jews stamps
005360.png,scene inter experiments nh
005361.png,hostel surfing courier cool amazoncouk africa
005362.png,Hentai excluded ate gel scenario move
005363.png,aim arrival volumes tips technical fleece coastal?
005364.png,role damages
005365.png,Nursing brooks steady singapore authentic busty
005366.png,jose seek mit function
005367.png,"Errors graphs istanbul, dodge"
005368.png,magazines together veterinary deadly privileges
005369.png,"das farmer phases banner, hostel incorporated"
005370.png,senate geo pepper
005371.png,italia allah original dated kills
005372.png,Republicans materials greetings toilet attractions build monaco
005373.png,standing fighting physiology midi berry
005374.png,Powers instructor system daily citizen books opt
005375.png,Larger solid prix boys?
005376.png,theories case virtue focused listings screw
005377.png,Freely closer flesh crisis largest enhancement
005378.png,Pentium especially individuals
005379.png,Russia consequence listen
005380.png,Strike completing kw flag dried
005381.png,wells inch rules acrobat
005382.png,"Investors grass alaska eu, place throwing hardwood"
005383.png,lying horse skip weekends allen!
005384.png,"career zdnet democracy, blue je centre nebraska"
005385.png,astrology lenses animation propecia pattern dialogue intermediate
005386.png,rj progressive stones farming fun?
005387.png,dpi bench essays ones
005388.png,represent dayton worthy
005389.png,Users tear jeans solving bras
005390.png,national populations fits!
005391.png,anderson triumph jerusalem shore hybrid za zen
005392.png,relate rebates derby underground solely unable
005393.png,malaysia rankings keep
005394.png,Canal california morris?
005395.png,sometimes tell shades wi hair
005396.png,maritime spread corrections
005397.png,strike anything
005398.png,Districts tomatoes.
005399.png,"mario committees jo, complex cnetcom"
005400.png,trained nationwide clone
005401.png,wooden charger veteran questions vbulletin adult
005402.png,paint prefer speaker aerospace ladies sad
005403.png,"sen template religions, glass."
005404.png,casting anti
005405.png,glow head incidents allen
005406.png,"Bryan hepatitis grants housewares, rfc delaware"
005407.png,nashville cpu principles cest facing
005408.png,shock trick
005409.png,Everything clara criminal usual vitamins permanent!
005410.png,"mercedes snake business, benchmark skating?"
005411.png,Provides trips sexy extension depend immune.
005412.png,accredited flowers strikes green moisture
005413.png,lesson tested receiving sustained innovative
005414.png,"spyware julie connections voting, width?"
005415.png,cooper nintendo consecutive jail solved offline started.
005416.png,"potato flow expressed supplement selecting, image"
005417.png,Guard sip iowa summary perhaps
005418.png,palm albums.
005419.png,Mechanisms experimental
005420.png,Guides freely terrorist
005421.png,Pets scenes
005422.png,super tongue writing twiki
005423.png,resource yorkshire customized
005424.png,displaying patent calif says mesh glory!
005425.png,presented doom smoke speeches concepts!
005426.png,tub sao endorsed dome ing flights
005427.png,Everyone optics poultry
005428.png,Wisdom tablets
005429.png,Tomorrow burning monday relation turning list marshall
005430.png,"incident inflation xxx qc, cute antibody groundwater"
005431.png,nurses fingering pro bill shipment pilot cute
005432.png,Near sponsor mercury
005433.png,Somerset float avoid
005434.png,"Election governmental mortgage, defensive graph receiver automated."
005435.png,substantial relevant inch distribution regulation passengers portraits
005436.png,victoria twenty users journalist worldcat judy quiz
005437.png,behalf supporting sydney terrorists chinese kijiji
005438.png,friend charity arrow chronic acknowledge
005439.png,Steam participant flu!
005440.png,goods nude straight red
005441.png,Faq respond broad
005442.png,receivers codes whose
005443.png,Yeast explain
005444.png,"Appeals occupations revenues sort levitra, extending second?"
005445.png,sd dsc pt dublin cohen watts
005446.png,Coordinated courier
005447.png,une reason arabia beats planes
005448.png,benefits walls unnecessary asthma rare tongue charges
005449.png,hoping guards palace camp texture
005450.png,pat migration per luke cs
005451.png,case selective structured incorporated religions?
005452.png,hiv ace
005453.png,sea resource listings third baskets surgery
005454.png,subscriber content radius religions
005455.png,civilization beneath bryant?
005456.png,referenced ukraine advertising
005457.png,qualify closest entry convert victorian era communicate
005458.png,village induction integrate specifies rugby proceeds.
005459.png,blowing conditions twins witness rich psi footwear
005460.png,"western peru, tension optics glance?"
005461.png,folder geek aviation symantec dump scripts know.
005462.png,gather bucks tries resolved consisting?
005463.png,knew spec par fails
005464.png,chief personnel!
005465.png,motherboard unusual diagnosis viewed configure expressed capabilities
005466.png,Mold hartford transaction
005467.png,Carbon condos mice restaurants
005468.png,chains computer
005469.png,attraction aluminium timber
005470.png,Homepage cliff proxy steps promising sheets mailto?
005471.png,poor listing
005472.png,bikes units embassy chick entered
005473.png,armenia univ pill lately channels legs lime.
005474.png,apr health azerbaijan misc transcripts
005475.png,knitting qualified bar your aa texts casino.
005476.png,Pac minus hu cruz messaging posters trembl!
005477.png,Going budgets
005478.png,commented mild provisions
005479.png,org hypothetical prevention sf breach might inspection
005480.png,franklin angle personals
005481.png,usc betting northern?
005482.png,india valium midnight alaska recording
005483.png,cr letter clay skin
005484.png,immediately betty deck fcc easter arts
005485.png,riverside stranger cheese lying spanish?
005486.png,"outcome pleased, sic major"
005487.png,becomes plans association creatures bibliography stockings mortgage
005488.png,"Albums algorithms, parcel surname"
005489.png,math sized drill
005490.png,surrounded islands gloves
005491.png,Zshops avoid got hurt consistency efficiency hamilton
005492.png,stainless determine
005493.png,horses animation guam alone skin
005494.png,"designed seniors elite, stationery totally drivers"
005495.png,Periodically gt represents lap intel
005496.png,confirmed isaac aaa pearl initiative employee?
005497.png,wiley princeton seeing smoking distribute
005498.png,laptop historical diary ky
005499.png,Replaced tales involve jacksonville printed.
005500.png,however totals georgia poor enhance oct
005501.png,campaigns string trailer.
005502.png,thereafter bottom beaches tuition vocal india
005503.png,victoria dh cattle
005504.png,prove disabilities!
005505.png,idea compact
005506.png,Tree lazy tractor!
005507.png,remind border bills shirts disco
005508.png,images kijiji
005509.png,Declare avoid partition firm workshops micro
005510.png,portland fundraising unified advertising
005511.png,Welfare suddenly?
005512.png,prove pasta pointing harbor
005513.png,sluts iowa essence
005514.png,Desirable station enjoying aaron mm syracuse
005515.png,nil virtual fucked paso intl human
005516.png,Correction place marker rug academic
005517.png,own enhanced desktops history controversy renaissance
005518.png,priorities classified cycles sydney explicitly perception sep
005519.png,described miller bringing fiji
005520.png,Rover mongolia automobile paperbacks
005521.png,seasons concerning
005522.png,Effort hist fixed usgs roger
005523.png,canadian decorating clocks
005524.png,removal que steal means comedy debt.
005525.png,Memorabilia guardian
005526.png,Appliances tomatoes
005527.png,Spray requiring seeker
005528.png,relation fit wolf quote lined cardiff.
005529.png,detail radar
005530.png,Thou disposal
005531.png,nz conditioning lyrics boring
005532.png,Residence walnut mailed tsunami abstracts ou?
005533.png,birds signal
005534.png,Glory mature club
005535.png,julian nb result daily slot guam.
005536.png,Agree deployment tours mandatory
005537.png,referenced litigation arms provide
005538.png,begin badge lens
005539.png,Born awards somerset medical
005540.png,Implemented disposal gilbert
005541.png,mounting effect?
005542.png,"Speaking upon, computed sunshine"
005543.png,"castle hours items neither, cultural flower"
005544.png,binary glenn reported presents develops narrow
005545.png,notification appeals bike headquarters arabic developers
005546.png,Nervous michelle
005547.png,expedia gotta
005548.png,Approximate savannah jenny video invitation framed?
005549.png,hall sharon refinance wave bedrooms cdna uruguay
005550.png,para apple excluded mold
005551.png,"handjob settings stocks, numerous istanbul bears teaching"
005552.png,pensions brand places!
005553.png,Silly coffee wheels cement aids af brochure
005554.png,legislation tags francisco botswana worldwide litigation.
005555.png,fraction virgin
005556.png,"announcement below origins, user assurance"
005557.png,tigers remained!
005558.png,courts silent players trinidad spots arctic.
005559.png,second transmit brochures db niger bytes telling
005560.png,visibility wrestling peaceful marilyn!
005561.png,Ba plugin confidential gently anna remedy tuesday
005562.png,month pens networking client
005563.png,Registered myth lat ooo
005564.png,eggs dicke
005565.png,Labeled bmw everybody ip pays
005566.png,Jungle eds boundaries ministries toll go buyer
005567.png,luther corporation mileage lee cbs
005568.png,quest gang fda our guides adidas!
005569.png,placing hopkins users prescribed connector drainage
005570.png,kept specifics indicator
005571.png,"moderators sing, motorola smithsonian emergency utilities"
005572.png,"plain publication thumbs, eos womens tomatoes!"
005573.png,show examines
005574.png,Afford process indexed
005575.png,miami nano
005576.png,develop wrong fifth!
005577.png,numerical adjacent pst continental place apply vendors
005578.png,gay elderly work silicon.
005579.png,precious rule excited developer archives vote
005580.png,"Endif claimed primary institute assist, ceramic"
005581.png,Population toronto freeware passes bukkake.
005582.png,Melissa guitars buses witness
005583.png,hour summary smoke
005584.png,returning ss
005585.png,expense corn davis relationship
